### ISSUE TITLE
keep-alive does not reuse already established connections to webhook

### ISSUE THREAD

**Issue by dyipon** [minio/minio#9460]
Setuped a webhook to get notification for every PUT event, but keep-alived connections aren't re-used between minio and webhook, thousand of connections remain established and unused

## Expected Behavior
minio should re-use the TCP connection between webhook and minioserver when using isActive()
already discussed [here](https://github.com/adnanh/webhook/issues/414#issuecomment-619471421)

## Current Behavior
Minio [isActive()](https://github.com/minio/minio/blob/4843affd0eab28e14e89de3f4c9a040d3b2659ca/pkg/event/target/webhook.go#L164) opening a new connection before every new notification, without re-using the already keep-alived connections. After a few hours minio runs out from available net sockets:
```
Apr 24 12:03:09 minio minio[85021]: Time: 12:03:09 CEST 04/24/2020
Apr 24 12:03:09 minio minio[85021]: DeploymentID: 1ac20d02-a235-46ae-a796-f9fba18885ba
Apr 24 12:03:09 minio minio[85021]: Error: not connected to target server/service
Apr 24 12:03:09 minio minio[85021]:        targetID=webhook, EventName=s3:ObjectCreated:Put
Apr 24 12:03:09 minio minio[85021]:        3: github.com/minio/minio@/cmd/logger/logonce.go:52:logger.(*logOnceType).logOnceIf()
Apr 24 12:03:09 minio minio[85021]:        2: github.com/minio/minio@/cmd/logger/logonce.go:80:logger.LogOnceIf()
Apr 24 12:03:09 minio minio[85021]:        1: github.com/minio/minio@/cmd/notification.go:1291:cmd.sendEvent.func1()
```

## Steps to Reproduce (for bugs)

1. ./minioclient admin config set myminio notify_webhook:1 queue_limit="0" endpoint="http://localhost:999/hooks/minio-webhook" queue_dir=""
2. ./minioclient event add myminio/bigbucket arn:minio:sqs::1:webhook --event put
3. upload something

## Your Environment

* Version used (`minio version`):  minio version RELEASE.2020-04-23T00-58-49Z
* Environment name and version (e.g. nginx 1.9.1):
* Server type and version:
* Operating System and version (`uname -a`): Linux minio 4.19.0-8-amd64 #1 SMP Debian 4.19.98-1 (2020-01-26) x86_64 GNU/Linux
* Link to your project:

**Comment by harshavardhana** [comment]
@dyipon what does your webhook respond back? as a response?  for the POST event?

**Comment by dyipon** [comment]
req:
```
POST /hooks/minio-webhook HTTP/1.1
Host: localhost:999
User-Agent: Go-http-client/1.1
Content-Length: 1186
Content-Type: application/json

```
response:
```
08:17:28.022889 IP6 ::1.999 > ::1.33036: Flags [P.], seq 376:451, ack 7970, win 512, options [nop,nop,TS val 265315821 ecr 265315820], length 75
`....k.@....................................sD%8!.*......s.....
..e...e.HTTP/1.1 200 OK
Date: Mon, 27 Apr 2020 06:17:28 GMT
Content-Length: 0"
```

**Comment by dyipon** [comment]
another tcdump, because previous maybe not relevant for isActive()

```

08:20:21.452701 IP6 ::1.33596 > ::1.999: Flags [.], ack 1, win 512, options [nop,nop,TS val 265489252 ecr 265489252], length 0
`.... .@.................................<.....K.[.8.....(.....
...d...d
08:20:21.452904 IP6 ::1.33596 > ::1.999: Flags [P.], seq 1:134, ack 1, win 512, options [nop,nop,TS val 265489252 ecr 265489252], length 133
`......@.................................<.....K.[.8...........
...d...dPOST /hooks/minio-webhook HTTP/1.1
Host: localhost:999
User-Agent: Go-http-client/1.1
Content-Length: 0
Accept-Encoding: gzip


08:20:21.452913 IP6 ::1.999 > ::1.33596: Flags [.], ack 134, win 511, options [nop,nop,TS val 265489252 ecr 265489252], length 0
`.&3. .@...................................<.[.8.........(.....
...d...d
08:20:21.454794 IP6 ::1.999 > ::1.33596: Flags [P.], seq 1:76, ack 134, win 512, options [nop,nop,TS val 265489254 ecr 265489252], length 75
`.&3.k.@...................................<.[.8.........s.....
...f...dHTTP/1.1 200 OK
Date: Mon, 27 Apr 2020 06:20:21 GMT
Content-Length: 0
```

**Comment by harshavardhana** [comment]
Figured out a right fix @dyipon - sending a PR
