### ISSUE TITLE
working with elixir (ExAws)

### ISSUE THREAD

**Issue by mvalitov** [minio/minio#2632]
I'm trying to set up job minio with the elixir(ExAws module). But I can not be authorized, even by "mc" everything works fine. I compared the trace using the mc and ExAws:
with mc:

```
Frame 5500: 582 bytes on wire (4656 bits), 582 bytes captured (4656 bits) on interface 0
Linux cooked capture
Internet Protocol Version 4, Src: 192.168.1.29, Dst: 192.168.1.29
Transmission Control Protocol, Src Port: 40972 (40972), Dst Port: 9000 (9000), Seq: 515, Ack: 755, Len: 514
Hypertext Transfer Protocol
    GET / HTTP/1.1\r\n
    Host: 192.168.1.29:9000\r\n
    User-Agent: Minio (linux; amd64) minio-go/2.0.1 mc/2016-08-21T03:02:49Z\r\n
    Authorization: AWS4-HMAC-SHA256 Credential=YON8M7WRT9X3CC36N4DK/20160907/us-east-1/s3/aws4_request, SignedHeaders=expect;host;x-amz-content-sha256;x-amz-date, Signature=a1cc962a655e63052d799004819b888032b7a9916f59d7028ac30a27689a4674\r\n
    Expect: 100-continue\r\n
    X-Amz-Content-Sha256: e3b0c44298fc1c149afbf4c8996fb92427ae41e4649b934ca495991b7852b855\r\n
    X-Amz-Date: 20160907T093957Z\r\n
    Accept-Encoding: gzip\r\n
    \r\n
    [Full request URI: http://192.168.1.29:9000/]
    [HTTP request 2/2]
    [Prev request in frame: 5494]
    [Response in frame: 5501]
```

and answer:
`HTTP/1.1 200 OK`

with ExAws:

```
Frame 1014: 516 bytes on wire (4128 bits), 516 bytes captured (4128 bits) on interface 0
Linux cooked capture
Internet Protocol Version 4, Src: 192.168.1.29, Dst: 192.168.1.29
Transmission Control Protocol, Src Port: 32886 (32886), Dst Port: 9000 (9000), Seq: 1, Ack: 1, Len: 448
Hypertext Transfer Protocol
    GET / HTTP/1.1\r\n
    x-amz-content-sha256: e3b0c44298fc1c149afbf4c8996fb92427ae41e4649b934ca495991b7852b855\r\n
     [truncated]Authorization: AWS4-HMAC-SHA256 Credential=YON8M7WRT9X3CC36N4DK/20160907/us-east-1/s3/aws4_request,SignedHeaders=content-length;host;x-amz-content-sha256;x-amz-date,Signature=38f07b5ca677e937cd444d5ea335f49f8dd2f04a86512a78ad9c
    User-Agent: hackney/1.6.1\r\n
    x-amz-date: 20160907T093819Z\r\n
    Host: 192.168.1.29:9000\r\n
    content-length: 0\r\n
    \r\n
    [Full request URI: http://192.168.1.29:9000/]
    [HTTP request 1/1]
    [Response in frame: 1016]
```

and answer:
`HTTP/1.1 403 Forbidden`

Hence the question, it is a problem "exaws" or "minio"? because with amazon s3 ExAws works correctly
## Minio version

Version: 2016-08-21T02:44:47Z
Release-Tag: RELEASE.2016-08-21T02-44-47Z
Commit-ID: 975eb319730c8db093b4744bf9e012356d61eef2
## System information

4.4.0-36-generic #55-Ubuntu SMP Thu Aug 11 18:01:55 UTC 2016 x86_64 x86_64 x86_64 GNU/Linux

**Comment by krishnasrinivas** [comment]
with ExAws I see:
`[truncated]Authorization: AWS4-HMAC-SHA256 Credential=YON8M7WRT9X3CC36N4DK/20160907/us-east-1/s3/aws4_request,SignedHeaders=content-length;host;x-amz-content-sha256;x-amz-date,Signature=38f07b5ca677e937cd444d5ea335f49f8dd2f04a86512a78ad9c`

i.e no `\r\n` at the end and `[truncated]` in the beginning which is odd

can you do `nc -l 9000` on  `192.168.1.29` and then execute the exaws and paste us the output?

**Comment by krishnasrinivas** [comment]
> i.e no \r\n at the end and [truncated] in the beginning which is odd

this would be a harmless warning by the dump tool you are using.

Also `content-length` should not be signed according to AWS docs, but even if it is signed it works with minio (as well as aws) so the issue must be something else.

**Comment by krishnasrinivas** [comment]
@MarsonV can you post your elixir script here?

**Comment by mvalitov** [comment]
Oh sure. Only it's not quite Elixir, a project on Phoenix framework. Simple project https://MarsonV@bitbucket.org/MarsonV/phoenix_minio.git

**Comment by krishnasrinivas** [comment]
golang takes out content-length from req.headers and it is available as req.ContentLength

@harshavardhana what do we do? be flexible like aws-s3 or adhere to standards and not include content-length for signature calculation?

**Comment by harshavardhana** [comment]
> @harshavardhana what do we do? be flexible like aws-s3 or adhere to standards and not include content-length for signature calculation?

This we might have to keep it because it might cause problems for many such apps.

> golang takes out content-length from req.headers and it is available as req.ContentLength

They shouldn't take it out since there is no reason it is not correct for Golang to change client sent headers. They did this previously with 'Expect' header which has been fixed subsequently.

As a work-around we can add "req.Header()" ourselves before doing signature calculation and mention it. (We have to not add Content-Length if req.ContentLength is -1 and TransferEncoding is set to chunked)

**Comment by krishnasrinivas** [comment]
There is another issue: https://github.com/CargoSense/ex_aws/issues/213

**Comment by krishnasrinivas** [comment]
https://github.com/minio/minio/pull/2643 fixes the content-length issue

**Comment by krishnasrinivas** [comment]
@MarsonV you can check with master branch of both minio and ex_aws. You can close the bug if it works fine.

**Comment by harshavardhana** [comment]
> @MarsonV you can check with master branch of both minio and ex_aws. You can close the bug if it works fine.

@MarsonV closing this issue as fixed, please re-open if issue persists.

**Comment by mvalitov** [comment]
Thank you! everything is working!

**Comment by mvalitov** [comment]
Hello, today I downloaded the new minio version, and once again faced with the same problem. I looked in the trace, and see that the port on the host field is present.

```
Frame 301: 511 bytes on wire (4088 bits), 511 bytes captured (4088 bits) on interface 0
Ethernet II, Src: 00:00:00_00:00:00 (00:00:00:00:00:00), Dst: 00:00:00_00:00:00 (00:00:00:00:00:00)
Internet Protocol Version 4, Src: 127.0.0.1, Dst: 127.0.0.1
Transmission Control Protocol, Src Port: 47081 (47081), Dst Port: 9000 (9000), Seq: 1, Ack: 1, Len: 445
Hypertext Transfer Protocol
    GET / HTTP/1.1\r\n
    x-amz-content-sha256: e3b0c44298fc1c149afbf4c8996fb92427ae41e4649b934ca495991b7852b855\r\n
     [truncated]Authorization: AWS4-HMAC-SHA256 Credential=SDPZD2A3627HX46NM6UU/20160918/us-east-1/s3/aws4_request,SignedHeaders=content-length;host;x-amz-content-sha256;x-amz-date,Signature=34a3d271ab2b892cdd493f50dc7067a0c07d40b3f7f32957b5b1
    User-Agent: hackney/1.6.1\r\n
    x-amz-date: 20160918T154648Z\r\n
    Host: 127.0.0.1:9000\r\n
    content-length: 0\r\n
    \r\n
    [Full request URI: http://127.0.0.1:9000/]
    [HTTP request 1/1]
    [Response in frame: 303]
```

my minio config:

```
{
    "version": "7",
    "credential": {
        "accessKey": "SDPZD2A3627HX46NM6UU",
        "secretKey": "Qw113u/BJFLnGS+yi+NOMcbUhh0gQk81Gkici6D3"
    },
    "region": "us-east-1",
    "logger": {
        "console": {
            "enable": true,
            "level": "fatal"
        },
        "file": {
            "enable": false,
            "fileName": "",
            "level": ""
        },
        "syslog": {
            "enable": false,
            "address": "",
            "level": ""
        }
    },
    "notify": {
        "amqp": {
            "1": {
                "enable": false,
                "url": "",
                "exchange": "",
                "routingKey": "",
                "exchangeType": "",
                "mandatory": false,
                "immediate": false,
                "durable": false,
                "internal": false,
                "noWait": false,
                "autoDeleted": false
            }
        },
        "elasticsearch": {
            "1": {
                "enable": false,
                "url": "",
                "index": ""
            }
        },
        "redis": {
            "1": {
                "enable": false,
                "address": "",
                "password": "",
                "key": ""
            }
        }
    }
}
```

This is a problem on my part or in the new version that not so?

**Comment by krishnasrinivas** [comment]
@MarsonV checking why it is not working on the release, but works on the master fine.

**Comment by harshavardhana** [comment]
> @MarsonV checking why it is not working on the release, but works on the master fine.

The following fix is missing in the release

```
commit 241c56e6d76baf1854675d011172b461017b3a79
Author: Kevin Qiu <kevinqiu1@gmail.com>
Date:   Tue Sep 13 13:59:40 2016 -0400

    Use Set instead of Add in the event that the request already contains the content-length (#2683)
```

Content-Length gets added in double. We will make a new release..

**Comment by krishnasrinivas** [comment]
@MarsonV there is a fix in the latest master which will fix this issue.

**Comment by krishnasrinivas** [comment]
> Content-Length gets added in double. We will make a new release..

right.

Initially what was happening was if a reverse proxy (traefik) is used it would remove `content-length:0` causing this problem.

@MarsonV you can use the latest master.

**Comment by mvalitov** [comment]
@krishnasrinivas thanks

**Comment by wahello** [comment]
A SDK named with minio-elixir should be added, I think.
