### ISSUE TITLE
CreateMultipartUpload with aws-sdk-java-v2 fails with: Invalid STS API version expecting 2011-06-15

### ISSUE THREAD

**Issue by rezss** [minio/minio#7279]
Hi,
i tried a few examples from Amazon with a Minio server running in docker. But unfortunately the "Upload Objects in Multiple Parts" [as described here](https://docs.aws.amazon.com/sdk-for-java/v2/developer-guide/examples-s3-objects.html#list-objects) won't work. Do i miss something, or is there a bug?

## Expected Behavior
A CreateMultipleUploadRequest should be successful.

## Current Behavior
A CreateMultipleUploadRequest fails with the following error: 
```
API: AssumeRoleInternalFunction()
Time: 16:07:18 UTC 02/23/2019
RequestID: 158609EDDDD7F785
RemoteHost: 172.17.0.1
UserAgent: aws-sdk-java/2.4.14 Mac_OS_X/10.14.4 OpenJDK_64-Bit_Server_VM/11.0.2+9 Java/11.0.2
Error: Invalid STS API version , expecting 2011-06-15
       1: cmd/sts-handlers.go:78:cmd.(*stsAPIHandlers).AssumeRoleWithJWT()
       2: cmd/sts-handlers.go:51:cmd.(*stsAPIHandlers).AssumeRoleWithJWT-fm()
       3: net/http/server.go:1964:http.HandlerFunc.ServeHTTP()
```
Wireshark recording:
```
Frame 39471: 867 bytes on wire (6936 bits), 867 bytes captured (6936 bits) on interface 0
Null/Loopback
Internet Protocol Version 4, Src: 127.0.0.1, Dst: 127.0.0.1
Transmission Control Protocol, Src Port: 52049, Dst Port: 9000, Seq: 1, Ack: 1, Len: 811
Hypertext Transfer Protocol
    POST /test-bucket/1550934497162?uploads HTTP/1.1\r\n
    Host: localhost:9000\r\n
    amz-sdk-invocation-id: bdf2ee9c-f733-0b02-0f1c-fc19fb69bc0f\r\n
    amz-sdk-retry: 0/0/500\r\n
     [truncated]Authorization: AWS4-HMAC-SHA256 Credential=SR7SHPUS3UPFD477J4CU/20190223/aws-global/s3/aws4_request, SignedHeaders=amz-sdk-invocation-id;amz-sdk-retry;content-length;content-md5;host;x-amz-content-sha256;x-amz-date, Signature=
    Content-MD5: 1B2M2Y8AsgTpgAmY7PhCfg==\r\n
    User-Agent: aws-sdk-java/2.4.14 Mac_OS_X/10.14.4 OpenJDK_64-Bit_Server_VM/11.0.2+9 Java/11.0.2\r\n
    x-amz-content-sha256: e3b0c44298fc1c149afbf4c8996fb92427ae41e4649b934ca495991b7852b855\r\n
    X-Amz-Date: 20190223T151015Z\r\n
    Content-Type: application/x-www-form-urlencoded; charset=utf-8\r\n
    Content-Length: 0\r\n
    Connection: Keep-Alive\r\n
    \r\n
    [Full request URI: http://localhost:9000/test-bucket/1550934497162?uploads]
    [HTTP request 1/1]
    [Response in frame: 39473]


Frame 39473: 749 bytes on wire (5992 bits), 749 bytes captured (5992 bits) on interface 0
Null/Loopback
Internet Protocol Version 4, Src: 127.0.0.1, Dst: 127.0.0.1
Transmission Control Protocol, Src Port: 9000, Dst Port: 52049, Seq: 1, Ack: 812, Len: 693
Hypertext Transfer Protocol
    HTTP/1.1 400 Bad Request\r\n
    Accept-Ranges: bytes\r\n
    Content-Security-Policy: block-all-mixed-content\r\n
    Content-Type: application/xml\r\n
    Server: Minio/RELEASE.2019-02-20T22-44-29Z\r\n
    Vary: Origin\r\n
    X-Amz-Request-Id: 158606D0C92B7847\r\n
    X-Minio-Deployment-Id: 3d61e450-fe10-4350-b71c-2efab33c5775\r\n
    X-Xss-Protection: 1; mode=block\r\n
    Date: Sat, 23 Feb 2019 15:10:15 GMT\r\n
    Transfer-Encoding: chunked\r\n
    \r\n
    [HTTP response 1/1]
    [Time since request: 0.001927000 seconds]
    [Request in frame: 39471]
    HTTP chunked response
    File Data: 297 bytes
eXtensible Markup Language
    <?xml
        version="1.0"
        encoding="UTF-8"
        ?>
    <ErrorResponse
        xmlns="https://sts.amazonaws.com/doc/2011-06-15/">
        <Error>
            <Type>
                </Type>
            <Code>
                MissingParameter
                </Code>
            <Message>
                A required parameter for the specified action is not supplied.
                </Message>
            </Error>
        <RequestId>
            158606D0C92B7847
            </RequestId>
        </ErrorResponse>
```
## Steps to Reproduce (for bugs)

1. Download the docker minio image with id af49f6661d6a
2. Use the java software.amazon.awssdk:s3:2.4.14 sdk
3. Provide the following code:
```
final var credentials = AwsBasicCredentials.create(accessKeyId, secretAccessKey);
final var key = "" + System.currentTimeMillis();

var s3 = S3Client
    .builder()
    .region(region)
    .endpointOverride(URI.create(endpointUrl))
    .overrideConfiguration(c -> c.putAdvancedOption(SdkAdvancedClientOption.SIGNER, AwsS3V4Signer.create()))
    .credentialsProvider(StaticCredentialsProvider.create(credentials))
    .build();

var createMultipartUploadRequest = CreateMultipartUploadRequest.builder().bucket(bucketName).key(key).build();
var response = s3.createMultipartUpload(createMultipartUploadRequest);
```

## Your Environment

* Version used (`minio version`): 2019-02-20T22:44:29Z

**Comment by harshavardhana** [comment]
The issue here is content-type is wrong I don't know why AWS sdk sets incorrect content-type for the call..

**Comment by rezss** [comment]
Yep, you were right.
Setting the content-type manually
```java
var createMultipartUploadRequest = CreateMultipartUploadRequest
    .builder()
    .bucket(bucketName)
    .key(key)
    .contentType("text/html")
    .build();
```
fixed the issue. Thanks a lot!

**Comment by harshavardhana** [comment]
This is a bug in aws-sdk-java AFAICS - there is no data uploaded during `createMultipartUploadRequest` - so setting 

>     Content-Type: application/x-www-form-urlencoded; charset=utf-8\r\n

Is buggy behavior, it should be set to `Content-Type: binary/octet-stream` or something set by the user - since this call is not a URL form upload and it will end up wrongly saving **application/x-www-form-urlencoded; charset=utf-8\r\n** for your content. 

Here is the documentation https://docs.aws.amazon.com/AmazonS3/latest/API/mpUploadInitiate.html

**Comment by rezss** [comment]
I opened an issue: https://github.com/aws/aws-sdk-java-v2/issues/1092

**Comment by nitisht** [comment]
closing the issue here, as there is nothing to be done from our side.
